Product Title,Price,Area,Price per m²,Bedrooms,Toilets,Location
Ban căn hộ tầng 2 view sân vườn - phố VIP Lê Thánh Tông - Hoàn Kiếm - Hà Nội,"6,96 tỷ",80 m²,"86,94 tr/m²",2,1,"Phan Chu Trinh, Hoàn Kiếm"
Ban quản lý cần bán căn hộ 1 T Place - 30A - Lý Thường Kiệt - Hà Nội,"10,8 tỷ",52 m²,"207,69 tr/m²",1,1,"Hàng Bài, Hoàn Kiếm"
"Bán căn hộ dịch vụ homestay, đường Ngô Quyền, Hoàn Kiếm. DT 50m2, SĐCC, giá 4,5 tỷ","4,5 tỷ",50 m²,90 tr/m²,1,1,"Lý Thái Tổ, Hoàn Kiếm"
"Bán căn hộ 116m2 vị trí vàng lõi quận Hoàn Kiếm giá 7,x tỷ",Giá thỏa thuận,116 m²,N/A,2,2,"Trần Hưng Đạo, Hoàn Kiếm"
Mở bán tòa PR2 mặt hồ San Hô - View đẹp nhất - Vip nhất - chiết khấu 12% cho khách booking sớm,Giá thỏa thuận,68 m²,N/A,2,2,"Gia Lâm, Hà Nội"
Siêu Hiếm - Phố cổ Hà Nội - Hộ Khẩu Hoàn Kiếm - Chính chủ nhượng lại căn hộ cho vk ck trẻ,"5,4 tỷ","49,6 m²","108,87 tr/m²",2,2,"Cửa Đông, Hoàn Kiếm"
"Bán gấp CH tập thể 36 Hai Bà Trưng 2PN 48m2 chào 5,9tỷ full NT sát Hàng Bài Tràng Tiền Hoàn Kiếm HN","5,9 tỷ",48 m²,"122,92 tr/m²",2,1,"Tràng Tiền, Hoàn Kiếm"
"Bán chung cư VIP phố Lý Nam Đế khu phân của Bộ Chính Trị, an ninh tuyệt đối 70m2 sổ đỏ - miễn TG","6,5 tỷ",70 m²,"92,86 tr/m²",2,2,"Cửa Đông, Hoàn Kiếm"
"Bán căn hộ cao cấp 3 phòng ngủ tại The Grand Hanoi - Đối diện Tràng Tiền Plaza, cách Hồ Gươm 100m",92 tỷ,155 m²,"593,55 tr/m²",3,N/A,"Hàng Bài, Hoàn Kiếm"
"KING CROW INFINITY - CĂN HỘ 2PN HẠNG SANG ĐỘC TÔN TRUNG TÂM TP THỦ ĐỨC, CHIẾC KHẤU 8% HTLS 30 THÁNG","8,8 tỷ",88 m²,100 tr/m²,2,2,"Thủ Đức, Hồ Chí Minh"
"Bán CC T-Place, Lý Thường Kiệt, 13 tỷ, 60m2, 2PN, 1WC, giá siêu hời",13 tỷ,60 m²,"216,67 tr/m²",2,1,"Hàng Bài, Hoàn Kiếm"
Tổng hợp quỹ căn chuyển nhượng siêu hiếm tại The Grand Hà Nội 22 - 24 Hàng Bài giá tốt - Ảnh thật,82 tỷ,140 m²,"585,71 tr/m²",3,2,"Hàng Bài, Hoàn Kiếm"
"Bán nhà tập thể tại Trần Hưng Đạo, Phan Chu Trinh, Hoàn Kiếm, Hà Nội, giá tốt 3,6tỷ 54m2 2 ngủ 1 vs","3,6 tỷ",54 m²,"66,67 tr/m²",2,1,"Phan Chu Trinh, Hoàn Kiếm"
Bán căn hộ 2PN chung cư T -Place - 30A Lý Thường Kiệt. Đã có sổ đỏ. Giá chỉ 13 tỷ. Lh: 0906 244 ***,13 tỷ,60 m²,"216,67 tr/m²",2,1,"Hàng Bài, Hoàn Kiếm"
"Bán căn hộ đẹp T - Place, Lý Thường Kiệt, Hoàn Kiếm, Hà Nội, 520m2, giá thỏa thuận",Giá thỏa thuận,520 m²,N/A,4,N/A,"Hàng Bài, Hoàn Kiếm"
"Bán nhà mặt phố Trần Quang Khải, phường Lý Thái Tổ, quận Hoàn Kiếm, Hà Nội",Giá thỏa thuận,"32,4 m²",N/A,N/A,N/A,"Lý Thái Tổ, Hoàn Kiếm"
"Bán siêu phẩm tại Quận Hoàn Kiếm, căn hộ 500m2 tại T-Place, giá thoả thuận. Liên hệ: Sơn 0906 244 ***",Giá thỏa thuận,500 m²,N/A,4,4,"Hàng Bài, Hoàn Kiếm"
"Bán suất ngoại giao căn góc siêu vip The Grand Hanoi, dịch vụ huyền thoại của Ritz Carlton. 155m2",75 tỷ,155 m²,"483,87 tr/m²",2,2,"Hàng Bài, Hoàn Kiếm"
"Bán chung cư Hàng Bài, Hoàn Kiếm 72m2. Full nội thất cao cấp, không gian sống của giới siêu giàu","14,4 tỷ",72 m²,200 tr/m²,3,2,"Hàng Bài, Hoàn Kiếm"
"Bán duplex, penthouse 400m2 dự án T - Place chính chủ giá rẻ",Giá thỏa thuận,400 m²,N/A,N/A,N/A,"Hàng Bài, Hoàn Kiếm"
Căn hộ hàng hiệu The Grand Hanoi - hàng hiếm trong bộ sưu tập bất động sản tại Hà Nội,80 tỷ,140 m²,"571,43 tr/m²",3,2,"Hàng Bài, Hoàn Kiếm"
"Bán căn hộ The Grand Hàng Bài Hà Nội, miễn phí quản lí và đỗ xe, không ở có thể cho CĐT thuê lại",78 tỷ,151 m²,"516,56 tr/m²",3,2,"Hàng Bài, Hoàn Kiếm"
"Chuẩn bị ra mắt shophouse, biệt thự Phú Thị Riverside tại Phú Thị, Gia Lâm dự kiến từ 11,5 tỷ/căn",N/A,N/A,N/A,N/A,N/A,N/A
Tập thể cơ hội có 102 nội thất đẹp. Gần ô tô tránh DT rộng giá rẻ trong tầm tay sổ căng nét,"3,2 tỷ",45 m²,"71,11 tr/m²",1,1,"Hàng Bài, Hoàn Kiếm"
"Bán suất ngoại giao căn góc siêu vip The Grand Hanoi, dịch vụ huyền thoại của Ritz Carlton. 155m2",75 tỷ,155 m²,"483,87 tr/m²",2,2,"Hàng Bài, Hoàn Kiếm"
Bán căn hộ hạng sang - vị trí kim cương - Tòa T Place - 30 A Lý Thường Kiệt - DT 58m2 - giá 14.5 tỷ,"14,5 tỷ",58 m²,250 tr/m²,2,1,"Hàng Bài, Hoàn Kiếm"
"Chính chủ cần bán tập thể Hàng Bồ DT 30m, đủ đồ bán 2.350 tỷ","2,35 tỷ",30 m²,"78,33 tr/m²",1,1,"Hàng Bồ, Hoàn Kiếm"
Mở bán tòa PR2 mặt hồ San Hô - View đẹp nhất - Vip nhất - chiết khấu 12% cho khách booking sớm,Giá thỏa thuận,68 m²,N/A,2,2,"Gia Lâm, Hà Nội"
"Lý Nam Đế - khu vip an ninh tuyệt đối, đẳng cấp giới tinh hoa - chủ tặng full nội thất","6,5 tỷ",70 m²,"92,86 tr/m²",2,2,"Hàng Mã, Hoàn Kiếm"
Cần bán căn hộ Pacific Place - Lý Thường Kiệt - Hà Nội giá từ 60 triệu/m2,"4,12 tỷ",71 m²,58 tr/m²,1,1,"Trần Hưng Đạo, Hoàn Kiếm"
Bán căn hộ tầng 2 mặt phố Phan Bội Châu,12 tỷ,110 m²,"109,09 tr/m²",3,N/A,"Trần Hưng Đạo, Hoàn Kiếm"
"Vip nhất phố cổ, tập thể Ngô Quyền, Hoàn Kiếm, kinh doanh, ban công view phố, 50m2 chỉ 4,39 tỷ","4,39 tỷ",50 m²,"87,8 tr/m²",1,1,"Trần Hưng Đạo, Hoàn Kiếm"
"KING CROW INFINITY - CĂN HỘ 2PN HẠNG SANG ĐỘC TÔN TRUNG TÂM TP THỦ ĐỨC, CHIẾC KHẤU 8% HTLS 30 THÁNG","8,8 tỷ",88 m²,100 tr/m²,2,2,"Thủ Đức, Hồ Chí Minh"
"Bán căn phố cổ - homestay Hàng Vôi - Hoàn Kiếm - sổ to, DT 40tr/tháng full nội thất Pháp nhỉnh 6 tỷ",Giá thỏa thuận,75 m²,N/A,2,N/A,"Lý Thái Tổ, Hoàn Kiếm"
"Nhà chính chủ Vọng Hà, 5p đi bộ ra bờ hồ","2,75 tỷ",55 m²,50 tr/m²,2,2,"Chương Dương, Hoàn Kiếm"
"Hoa hậu phố cổ! Homestay Hàng Vôi, Hoàn Kiếm, dòng tiền 40tr/tháng, 75m2 2PN nhà đẹp chỉ 6,68 tỷ","6,68 tỷ",75 m²,"89,07 tr/m²",2,1,"Lý Thái Tổ, Hoàn Kiếm"
"Chuyển nhượng căn hộ 3 phòng ngủ chung cư The Grand Hà Nội, Hàng Bài, Hoàn Kiếm chỉ 109 tỷ",109 tỷ,164 m²,"664,63 tr/m²",3,2,"Hàng Bài, Hoàn Kiếm"
"Giá rẻ! Chỉ 3,49 tỷ tập thể Hàng Vôi, Ba Đình, 2 thoáng, làm homestay 60m2 2PN ở ngay","3,49 tỷ",60 m²,"58,17 tr/m²",2,1,"Lý Thái Tổ, Hoàn Kiếm"
Hoa hậu phố cổ - Homestay Hàng Vôi - Hoàn Kiếm - Căn góc 60m2 chỉ 3.5 tỷ - Giá đầu tư,"3,5 tỷ",60 m²,"58,33 tr/m²",N/A,N/A,"Lý Thái Tổ, Hoàn Kiếm"
Quá hiếm! TT Nguyên Văn Tố - Chợ Hàng Da - Hoàn Kiếm - lô góc - Sổ to 60m2 - 2 ngủ ở luôn chỉ 3.5tỷ,"3,5 tỷ",60 m²,"58,33 tr/m²",2,N/A,"Cửa Đông, Hoàn Kiếm"
"(Chính chủ) Bán căn hộ 75m2 2 ngủ 2 vệ sinh, mặt phố Trần Hưng Đạo, giá 6 tỷ",6 tỷ,75 m²,80 tr/m²,2,2,"Trần Hưng Đạo, Hoàn Kiếm"
Homestay Hoàn Kiếm mặt phố gần nhà hát lớn dòng tiền 40 triệu/tháng,"4,5 tỷ",50 m²,90 tr/m²,2,1,"Trần Hưng Đạo, Hoàn Kiếm"
"Căn hộ The Grand Hà Nội, Hàng Bài, Hoàn Kiếm, 3 ngủ chỉ 115 tỷ",115 tỷ,150 m²,"766,67 tr/m²",3,2,"Hàng Bài, Hoàn Kiếm"
"Chuyển nhượng căn hộ The Grand Hà Nội, Hàng Bài, Hoàn Kiếm, 3 phòng ngủ chỉ 145 tỷ",145 tỷ,152 m²,"953,95 tr/m²",3,2,"Hàng Bài, Hoàn Kiếm"
"Tôi cần bán nhà TT phố cổ Hàng Bồ Hoàn Kiếm DT 27m2, có tầng lửng, bếp vệ sinh riêng giá 2.1 tỷ","2,1 tỷ",27 m²,"77,78 tr/m²",2,1,"Hàng Bồ, Hoàn Kiếm"
"Chuẩn bị ra mắt shophouse, biệt thự Phú Thị Riverside tại Phú Thị, Gia Lâm dự kiến từ 11,5 tỷ/căn",N/A,N/A,N/A,N/A,N/A,N/A
"Bán căn hộ tập thể Ngô Quyền, 50m2, 1 ngủ, 1 khách, 1 WC, 1 ban công, full nội thất, về ở luôn","4,39 tỷ",50 m²,"87,8 tr/m²",1,1,"Lý Thái Tổ, Hoàn Kiếm"
"Chuyển nhượng căn hộ The Grand Hà Nội, Hàng Bài, Hoàn Kiếm, 3 ngủ chỉ 80 tỷ",80 tỷ,141 m²,"567,38 tr/m²",3,2,"Hàng Bài, Hoàn Kiếm"
"Lý Nam Đế - khu vip an ninh tuyệt đối, đẳng cấp giới tinh hoa - chủ tặng full nội thất","6,5 tỷ",70 m²,"92,86 tr/m²",2,2,"Hàng Mã, Hoàn Kiếm"
"Bán căn hộ cao cấp Lý Nam Đế khu vực vip, an ninh đảm bảo","6,5 tỷ",70 m²,"92,86 tr/m²",2,2,"Cửa Đông, Hoàn Kiếm"
Mở bán tòa PR2 mặt hồ San Hô - View đẹp nhất - Vip nhất - chiết khấu 12% cho khách booking sớm,Giá thỏa thuận,68 m²,N/A,2,2,"Gia Lâm, Hà Nội"
"Bán chung cư VIP phố Lý Nam Đế khu phân của Bộ Chính Trị, an ninh tuyệt đối 70m sổ đỏ - miễntgian","6,5 tỷ",70 m²,"92,86 tr/m²",2,2,"Cửa Đông, Hoàn Kiếm"
"Bán penthouse đẳng cấp thượng lưu giữa lòng Hà Nội.
Hàng xóm toàn là những người nổi tiếng bậc nhất",106 tỷ,500 m²,212 tr/m²,6,6,"Phan Chu Trinh, Hoàn Kiếm"
"Bán nhà riêng tầng 2 đầy đủ tiện nghi, ngõ 58 Hàng Bồ, Hoà Kiếm, Hà Nội","2,9 tỷ",23 m²,"126,09 tr/m²",1,2,"Hàng Bồ, Hoàn Kiếm"
"Siêu phẩm tập thể Lý Thường Kiệt - Hoàn Kiếm ôtô đỗ cửa chỉ 2,6 tỷ","2,6 tỷ",32 m²,"81,25 tr/m²",2,2,"Cửa Nam, Hoàn Kiếm"
"Chuẩn bị ra mắt shophouse, biệt thự Phú Thị Riverside tại Phú Thị, Gia Lâm dự kiến từ 11,5 tỷ/căn",N/A,N/A,N/A,N/A,N/A,N/A
